{
  "created_at": "2026-09-05T07:53:32.110335Z",
  "fidelity_review_ids": [
    "RFR-102"
  ],
  "lineage_id": "RRL-001",
  "parent_route_ids": [
    "ER-101"
  ],
  "provenance": {
    "validator": "package_b"
  },
  "redigestion_request_id": "RDR-001",
  "revised_route_ids": [
    "ER-102"
  ],
  "schema_version": "3.0-post-p1p5-b",
  "status": "VALIDATED"
}
